{
  "schemaVersion": 1,
  "id": "bb841b14-6082-8016-971b-a025621fe7c3",
  "turnId": "7a56453a-0979-8b0a-a4fe-ddbc9aab354a",
  "workstreamId": "815c7a44-59df-8102-9769-bf8a74e49c0c",
  "kind": "adversarial",
  "target": "code",
  "reviewer": "agent:sl-dev-break:w008-slc01",
  "verdict": "request-changes",
  "blocking": true,
  "alertOnSeverity": "high",
  "plainSummary": "Agents could still record decisions and approvals after permission ends, including an approval labeled as human.",
  "summary": "The shared operation boundary suite ran seven adversarial cases against the current tree: four passed and three failed. Invalid slices are rejected before seal/turn/activation/automation effects; caller-supplied roots are rejected; progress honors permission; and stale revision/source inputs leave domain records unchanged. Decision and code-review writes omit the current permission check, and the portable review operation accepts caller-supplied kind:human/reviewer labels that can satisfy the code-review gate. Receipt killers remain green separately; actual MCP lifecycle coverage is still pending.",
  "findings": [
    {
      "id": "43ba6379-4428-8692-9349-9440c6353046",
      "severity": "high",
      "claimId": "2f8cf085-d7a5-83b9-89f8-9d0754cb16a0",
      "gap": "packages/ledger/src/application/operations.ts submitDecision checks revision and source but not permissionStatus before writeDecision. The breaker removed all authority from an open workstream turn; executeOperation(record_decision) succeeded instead of returning permission_denied and persisted a decision.",
      "plainImpact": "An agent could keep recording consequential decisions after its permission has ended.",
      "fixProposal": "Inside the serialized record_decision effect, require current applicable permission for the turn's workstream before calling writeDecision; retain revision/source checks and leave no decision on denial.",
      "evidence": {
        "kind": "test",
        "citedTest": "packages/ledger/src/application/operations.break.test.ts::denies record_decision without current permission and creates no domain record",
        "ran": true,
        "command": "node --test packages/ledger/dist/application/operations.break.test.js",
        "observedOutput": "FAIL denies record_decision without current permission and creates no domain record: AssertionError: operation unexpectedly succeeded"
      }
    },
    {
      "id": "79a2ed24-4a83-86e6-9874-8a6b66bde28c",
      "severity": "high",
      "claimId": "2f8cf085-d7a5-83b9-89f8-9d0754cb16a0",
      "gap": "packages/ledger/src/application/operations.ts submitReview validates source and open-turn state but not current permission before writeReview and the slice codeBreakReviewId update. The breaker removed all authority; executeOperation(record_review) still saved an approval and updated plan metadata.",
      "plainImpact": "A review submitted after permission ends could still clear the code-review checkpoint.",
      "fixProposal": "Inside the serialized code-review effect, require current applicable permission for the turn's workstream before writing the review or updating codeBreakReviewId; denial must leave both paths unchanged.",
      "evidence": {
        "kind": "test",
        "citedTest": "packages/ledger/src/application/operations.break.test.ts::denies record_review without current permission and creates no domain record",
        "ran": true,
        "command": "node --test packages/ledger/dist/application/operations.break.test.js",
        "observedOutput": "FAIL denies record_review without current permission and creates no domain record: AssertionError: operation unexpectedly succeeded"
      }
    },
    {
      "id": "7a5c0b98-85ad-8eb0-a9e9-7113f50e6ba2",
      "severity": "high",
      "claimId": "2f8cf085-d7a5-83b9-89f8-9d0754cb16a0",
      "gap": "The portable shared record_review operation accepts review.kind=human and reviewer=human:project-owner from untrusted operation input. writeReview preserves those fields, and isCodeBreakApprove accepts non-discussion human approvals with killersCited, so caller labels can be displayed and evaluated as a human review without host-authenticated provenance. Historical human review records are outside this finding.",
      "plainImpact": "An agent could label its own portable review as human-approved and clear the review gate.",
      "fixProposal": "Reject kind:human on the portable CLI/MCP review operation and treat reviewer text only as agent-reported attribution; preserve loading of existing historical human records and reserve verified human writes for a bounded host adapter.",
      "evidence": {
        "kind": "test",
        "citedTest": "packages/ledger/src/application/operations.break.test.ts::does not accept portable review fields that claim human provenance",
        "ran": true,
        "command": "node --test packages/ledger/dist/application/operations.break.test.js",
        "observedOutput": "FAIL does not accept portable review fields that claim human provenance: AssertionError: operation unexpectedly succeeded"
      }
    }
  ],
  "residualRisks": [
    "The operation hunt is not complete: actual MCP lifecycle, explicit check execution, completion, and CLI/MCP parity remain for separate run-backed coverage.",
    "Portable reviewer labels remain agent-reported attribution even after kind:human is rejected; stronger reviewer identity requires a host that can attest execution identity.",
    "Receipt concurrency, corrupt replay, unfinished retry, failed completion publication, and unknown-lock killers pass in the separate receipt suite."
  ],
  "treeDigest": "15914e969cf8580352ee941671fab4de8bd23aa0188583ee3a7df579c5968aba",
  "migration": {
    "origins": {
      "e55f1c9afd4f97d11e764eb0afafb544d4eedda1": {
        "path": ".spec-ledger/reviews/turns/T-034/R-01.json",
        "id": "T-034/R-01",
        "sha256": "d09309d3cea0224f66721f7463b8a159c3dba24b2ae77991b6f0d6eed0d4fd79"
      },
      "77e6ea9e209ed85611befed63e413aff34e56d46": {
        "path": ".spec-ledger/reviews/turns/T-034/R-01.json",
        "id": "T-034/R-01",
        "sha256": "d09309d3cea0224f66721f7463b8a159c3dba24b2ae77991b6f0d6eed0d4fd79"
      }
    },
    "historical": true
  }
}
