{
  "schemaVersion": 1,
  "id": "5b790a52-349d-8536-9122-fab870709c14",
  "workstreamId": "d1be55a6-11bb-8460-8650-ddf0ecac8185",
  "kind": "adversarial",
  "target": "spec",
  "reviewer": "agent:sl-plan-break-spec",
  "verdict": "approve",
  "blocking": false,
  "alertOnSeverity": "high",
  "summary": "Re-break after SR-03 amends. Related: features=6 (cli/verify/client/server/lattice/turns), claims 67609c19-de05-862c-8db7-e5dc95f38cee..004/006..008, 628207d3-7b88-880b-abe1-acd523f8572f..019, worktree caution-only. Highs cleared: F1 grandfather (check-seal skips doc check when no expected digest; audit warn spec-doc-digest-missing; error spec-doc-digest-drift only when expected exists) in pitch + d1be55a6-11bb-8460-8650-ddf0ecac8185 acceptance + 1f1b46eb-ad28-8870-b46d-9826d55aaa1c + outOfScope; F2 last expected = latest afterDocDigest else seal.specDocDigest, never mutate seal.specDocDigest, amend appends only. SR-03 moderates also addressed: audit error|warn rule ids named; amend sealed-only + no-op refuse + humanConfirmed via --by; seal-digest-drift ERROR in-slice in 1f1b46eb-ad28-8870-b46d-9826d55aaa1c. Soft residual only: grandfather stamp-only amend may conflict with before===after no-op (re-seal still backfills). Not alert-threshold.",
  "plainSummary": "The holes are closed; sealed-plan digests, grandfather behavior, and publish/init rules are clear enough to seal and build.",
  "resolvesReviewId": "e0f64191-27f8-83ee-942a-473bf1ab3bb6",
  "resolvesFindingIds": [
    "e0f64191-27f8-83ee-942a-473bf1ab3bb6#a4328863-248f-8ca6-a610-2cee00031172",
    "e0f64191-27f8-83ee-942a-473bf1ab3bb6#d92b0158-4fa4-8934-af56-88ffeb747f26",
    "e0f64191-27f8-83ee-942a-473bf1ab3bb6#ff9d475f-aa59-8ec1-be0e-e406b00a980b",
    "e0f64191-27f8-83ee-942a-473bf1ab3bb6#71ac821c-d692-893d-9443-768116a087df",
    "e0f64191-27f8-83ee-942a-473bf1ab3bb6#2e7f493a-0a2e-8f3a-b2cc-140b826b1725",
    "e0f64191-27f8-83ee-942a-473bf1ab3bb6#4ecd3303-16a4-82a9-80e3-28a9cd67bb40",
    "e0f64191-27f8-83ee-942a-473bf1ab3bb6#6663a7d4-4fb2-8b7c-b4ab-33fa40b9ab2d"
  ],
  "supersedesReviewId": "e0f64191-27f8-83ee-942a-473bf1ab3bb6",
  "residualRisks": [
    "Grandfather stamp-only amend: if beforeDocDigest falls back to current file hash and after is also current, no-op refuse blocks a no-byte-change backfill — re-seal still works; at build prefer allow first amend when no prior expected digest even if before===after, or document re-seal-only backfill",
    "humanConfirmed:true whenever --by is set trusts the caller (agent-with-instruction) — process, not a seal blocker",
    "UTF-8 / line-ending sensitivity of sha256(utf8 file bytes)",
    "Graph feature cli.claimIds empty until PC→SL promote",
    "worktree scan caution-only — not a seal blocker",
    "## Modifications is human convention only (not audited)",
    "Proposed killers: K-init-table, K-init-reinit, K-init-no-pass, K-pack-ledger-bin, K-pack-no-workspace, K-ui-asset-no-file-deps, K-publish-yml-triggers, K-version-tag-match, K-seal-specdoc-digest, K-check-seal-doc-last-expected, K-check-seal-grandfather-skip, K-amend-before-after-noop, K-amend-sealed-only, K-audit-spec-doc-drift-error, K-audit-spec-doc-missing-warn, K-audit-seal-digest-drift-error"
  ],
  "findings": [
    {
      "id": "ae3fe53f-43db-89cb-bcbb-f03d6c839787",
      "severity": "moderate",
      "claimId": "1f1b46eb-ad28-8870-b46d-9826d55aaa1c",
      "gap": "Pitch says first amend on a grandfather seal backfills the trail with beforeDocDigest = current file hash when no expected digest exists, and also refuses no-op when before===after. A stamp-only backfill (no byte edit) therefore always no-ops. OutOfScope still allows re-seal backfill, so dogfood is not broken — clarify at build.",
      "plainImpact": "Teams may think a no-edit amend alone stamps old seals when only a re-seal or a real edit works as written.",
      "fixProposal": "At 520ff720-fc13-8275-b710-f677f8d2efb4 implement: when no prior expected digest, allow append with before===after as explicit backfill; or document that grandfather backfill is re-seal-only / requires a byte change. Not required before human seal.",
      "evidencePath": "docs/workstreams/consumer-cli-and-npm-publish.md"
    },
    {
      "id": "0c337939-f82c-86c2-93ad-279874d6b310",
      "severity": "low",
      "gap": "Spec-break approve only — human must seal d1be55a6-11bb-8460-8650-ddf0ecac8185 (specDigest + sealedBy + new seal.specDocDigest on the pitch file) before sl-dev-build. Agent must not seal.",
      "plainImpact": "Until a human seals, builders must not treat this bet as approved to implement.",
      "fixProposal": "Human reads pitch + 628207d3-7b88-880b-abe1-acd523f8572f..019 + SR-03/SR-04, then seals via workstream seal CLI with specBreakReviewId 5b790a52-349d-8536-9122-fab870709c14.",
      "evidencePath": ".spec-ledger/workstreams/d1be55a6-11bb-8460-8650-ddf0ecac8185.json"
    }
  ],
  "migration": {
    "origins": {
      "e55f1c9afd4f97d11e764eb0afafb544d4eedda1": {
        "path": ".spec-ledger/reviews/workstreams/W-005/SR-04.json",
        "id": "W-005/SR-04",
        "sha256": "c4ff65b3c621cfc30ca611ca8793bdea7dced6124bedb4e2f35fa35d6edf3956"
      },
      "77e6ea9e209ed85611befed63e413aff34e56d46": {
        "path": ".spec-ledger/reviews/workstreams/W-005/SR-04.json",
        "id": "W-005/SR-04",
        "sha256": "c4ff65b3c621cfc30ca611ca8793bdea7dced6124bedb4e2f35fa35d6edf3956"
      }
    },
    "historical": true
  }
}
