{
  "schemaVersion": 1,
  "id": "T-038/R-04",
  "turnId": "T-038",
  "workstreamId": "W-010",
  "kind": "human",
  "target": "code",
  "reviewer": "agent:align",
  "verdict": "approve",
  "summary": "User explicitly requested saved test execution, Nessa code rendering and plain feature wording. All product paths remain within the preserved packages, schemas, docs and skills scope.",
  "plainSummary": "The changes cover the requested test evidence, syntax highlighting and readable feature descriptions.",
  "treeDigest": "1928c529067013cc45fdbdf5153d5496b2f07bd62e5de9a327f1938374c1a746",
  "uncoveredPaths": [],
  "coverageSource": "mixed"
}
