{
  "schemaVersion": 1,
  "id": "W-014/SR-02",
  "workstreamId": "W-014",
  "target": "spec",
  "kind": "adversarial",
  "reviewer": "agent:sl-plan-break-spec-independent",
  "verdict": "approve",
  "blocking": false,
  "plainSummary": "The dedicated workflow builder can show stages on a canvas while preserving linear execution and shared validation.",
  "summary": "Independent bounded review of the post-seal document amendment recorded by T-044/D-01 and W-014.postSealAmends. Refreshed CLI related pack retains client, cli and lattice boundaries and the existing workflow claims. The user correction expressly requests a dedicated Nessa UI workflow builder. The amendment changes presentation and entry point only: library New/Edit links open the builder; the canvas preserves execution order, forbids branches and loops, and uses the existing shared preview/save validator. This remains within SLC-03 ordered-stage acceptance and existing feature-scoped request permission. Session observation confirms permission.allowed=true and seal checklist done with immutable revision 1 plus its amendment. planRevision includes live document bytes, so SR-01 became stale despite a valid seal; this current revision-bound review restores the independent spec-review gate without resealing or modifying snapshot digests. Product behavior still requires code-break and browser regression evidence.",
  "alertOnSeverity": "high",
  "findings": [],
  "residualRisks": [
    "Verify New workflow and Edit navigation, selected-stage inspector editing, preview and save through the real UI; this spec review does not establish implementation correctness.",
    "The related CLI supplies a caution-only note rather than structured sibling scan evidence.",
    "Completion additionally needs current implementation/evidence, every required code review and closed turns; the preserved snapshot and amendment alone do not complete the workstream."
  ],
  "supersedesReviewId": "W-014/SR-01",
  "revisionDigest": "099ff6370bf857a6468c7dd531170df205ac74b77e7030031d5626adf6491ba0"
}
