{
  "schemaVersion": 1,
  "id": "beab61c5-71c7-81f8-8da8-c38337869c55",
  "turnId": "da84f6c1-3d94-8d66-8f41-dd67dfc07df0",
  "workstreamId": "d1be55a6-11bb-8460-8650-ddf0ecac8185",
  "kind": "adversarial",
  "target": "code",
  "reviewer": "agent:sl-dev-break",
  "verdict": "request-changes",
  "blocking": true,
  "treeDigest": "5da036c4f10b701e04b16162c2446bf95c808be7334cc459533ec918164b5f96",
  "alertOnSeverity": "high",
  "summary": "4a65c48e-eaf5-8e43-b1b6-4c7bc8c793ca / ebc0a361-534e-8527-99a7-57611aae823d killers: 4 green (deep shipped-tree walk incl node_modules zero file:/workspace:; publish.yml NESSA_UI_ROOT+dist build+no --skip-build+contents:write upload; pack fails closed on missing NESSA_UI_ROOT/agent-stream; packaged @nessalabs scope + tarball version matches ledger). Red: README UI Release section omits @nessalabs/spec-ledger-server — sealed d1be55a6-11bb-8460-8650-ddf0ecac8185 4a65c48e-eaf5-8e43-b1b6-4c7bc8c793ca acceptance requires documenting published client/server + Release UI asset; ebc0a361-534e-8527-99a7-57611aae823d same. Builder smoke only checks client/SPEC_LEDGER_ROOT.",
  "plainSummary": "The UI Release download path is documented, but the README never tells consumers how published server fits with that asset.",
  "findings": [
    {
      "id": "60f53998-474a-8fb7-8432-4562e3dfd1ce",
      "severity": "high",
      "claimId": "ebc0a361-534e-8527-99a7-57611aae823d",
      "gap": "README ### Spec Ledger UI from a Release asset mentions vendored @nessalabs/spec-ledger-client and the spec-ledger-ui-*.tgz one-liner, but never @nessalabs/spec-ledger-server. Sealed d1be55a6-11bb-8460-8650-ddf0ecac8185 4a65c48e-eaf5-8e43-b1b6-4c7bc8c793ca acceptance: \"README documents one-liner: published client/server + Release Spec Ledger UI asset against a consumer .spec-ledger/\"; ebc0a361-534e-8527-99a7-57611aae823d requires the same published client/server + asset framing. Killer: packages/ledger/src/ui-release.break.test.ts::README documents published client/server + Release UI asset (4a65c48e-eaf5-8e43-b1b6-4c7bc8c793ca acceptance).",
      "plainImpact": "A consumer following only the UI Release section would not know they still need the published server package for the documented client/server + asset path.",
      "fixProposal": "In README Spec Ledger UI Release section, document published @nessalabs/spec-ledger-client and @nessalabs/spec-ledger-server (npm install from Release) together with downloading the spec-ledger-ui-*.tgz asset and pointing SPEC_LEDGER_ROOT at the consumer ledger. Keep path B: do not instruct npm install of unpublished @nessalabs/ui.",
      "evidence": {
        "kind": "test",
        "citedTest": "packages/ledger/src/ui-release.break.test.ts::README documents published client/server + Release UI asset (4a65c48e-eaf5-8e43-b1b6-4c7bc8c793ca acceptance)",
        "ran": true,
        "command": "pnpm --filter @nessalabs/spec-ledger build && node --test packages/ledger/dist/ui-release.break.test.js",
        "observedOutput": "AssertionError [ERR_ASSERTION]: UI section must mention published server (sealed acceptance / ebc0a361-534e-8527-99a7-57611aae823d); expected: /@nessalabs\\/spec-ledger-server/"
      }
    }
  ],
  "killersCited": [
    "packages/ledger/src/ui-release.break.test.ts::shipped tree incl node_modules has zero file:/workspace: protocols",
    "packages/ledger/src/ui-release.break.test.ts::README documents published client/server + Release UI asset (4a65c48e-eaf5-8e43-b1b6-4c7bc8c793ca acceptance)",
    "packages/ledger/src/ui-release.break.test.ts::publish.yml packs UI Release asset with NESSA_UI_ROOT, dist build, no --skip-build, contents:write upload",
    "packages/ledger/src/ui-release.break.test.ts::pack-ui-release fails closed when NESSA_UI_ROOT / agent-stream missing",
    "packages/ledger/src/ui-release.break.test.ts::packaged UI name/deps stay @nessalabs/* and tarball version matches ledger"
  ],
  "residualRisks": [
    "Hunt budget: one out-of-intent killer used (@nessa scope leftover + tarball/ledger version) — passed.",
    "Builder smoke walkPackageJson skips node_modules; pack assert + breaker deep walk cover nested package.json — residual if smoke is sole binding evidence later.",
    "onAlert=wait for high — human/timeout before close."
  ],
  "migration": {
    "origins": {
      "e55f1c9afd4f97d11e764eb0afafb544d4eedda1": {
        "path": ".spec-ledger/reviews/turns/T-024/R-01.json",
        "id": "T-024/R-01",
        "sha256": "8496db905305e5917655c5d25839d38a86d7894aff3d19ef1e453972c73e9758"
      },
      "77e6ea9e209ed85611befed63e413aff34e56d46": {
        "path": ".spec-ledger/reviews/turns/T-024/R-01.json",
        "id": "T-024/R-01",
        "sha256": "8496db905305e5917655c5d25839d38a86d7894aff3d19ef1e453972c73e9758"
      }
    },
    "historical": true
  }
}
