{
  "schemaVersion": 1,
  "id": "W-006/SR-02",
  "workstreamId": "W-006",
  "kind": "adversarial",
  "target": "spec",
  "reviewer": "agent:sl-plan-break-spec:w006",
  "verdict": "approve",
  "blocking": false,
  "alertOnSeverity": "high",
  "supersedesReviewId": "W-006/SR-01",
  "plainSummary": "Each implementation slice now links to explicit behavioral checks, with browser observations recorded separately.",
  "summary": "Independent review of W006 acceptanceClaimIds maps SLC01..06/AC1 to SL016..021 and six command bindings, without relaxing acceptance. Reran all mapped suites together:41pass0fail0skip. Latest related --workstream W006 pack has6features16liveclaims23docs and0deferrals. SL016 aggregation/transport, SL017 read effects, SL018 evidence-source/check freshness versus source-only review freshness and artifact integrity, SL019 explicit authority/corrections, SL020 durable deferred obligations, SL021 honest session projections/current permission match the tests. SL018 wording was clarified to avoid claiming ledger check metadata invalidates source-only code review. SLC06 browser acceptance is supplemented by root-reported manual observations of mixed1/3 current evidence, independent implementation state, due isolation, unconfirmed preview, honest CLI handoff, disconnect,655px rail clearance and missing-graph fallback; automated SL021 does not itself prove visual layout. Tool stamps revision after the specBreakReviewId pointer is set; no historical seal/review overwritten.",
  "findings": [],
  "residualRisks": [
    "Browser observations attributed to root, not an independently repeated browser campaign. Only655px rail evidence available; additional widths/toggle validation unverified.",
    "Command bindings execute compiled dist and assume the required build precedes checks; fingerprints establish correspondence, not authenticated producer honesty.",
    "Related lookup did not request a sibling worktree scan in this final mapping review; no cross-checkout claim is made.",
    "This review approves the concrete verification mapping and documented scope; it does not create user consent or mark the workstream complete."
  ],
  "revisionDigest": "f8c6f8bfb42b36a27288d6e1841ccc5417c0972c6db15d936e3092bff2f23cab"
}
